{
    "kind": "both",
    "base": "209cb212e97f7565482dd7a01c75370cad28b79b",
    "verdict_all_clean": false,
    "head": "07d27fbf6e227729f659698fcedd29ce1beba78d",
    "dispositions": {
    },
    "diffstat": "catalog/hats/doc-policy.toml                       |   2 +-\n catalog/hats/latex-typesetter.toml                 |   3 +-\n catalog/hats/structure-consistency.toml            |   2 +-\n catalog/scans.toml                                 |   2 +-\n docs/ARCHITECTURE.md                               |  84 +++--\n docs/prose_shape.csv                               | 211 ++++++------\n docs/src/api/CLI.md                                |   1 +\n docs/src/guide/config.md                           |   5 +-\n docs/src/guide/install.md                          |   6 +-\n docs/src/guide/rounds.md                           |   3 +-\n docs/src/guide/verbs.md                            |   4 +-\n fixture/GBG Fixture/defects.toml                   |   5 +\n fixture/GBG Fixture/defects/page.md                |   3 +\n fixture/GBG Fixture/docs/prose_shape.csv           |   2 +-\n fixture/GBG Fixture/docs/src/index.md              |   3 +-\n fixture/GBG Fixture/src/FixtureC.jl                |  12 +\n instruments/audit-changes/PROTOCOL.md              |   5 +\n .../audit-changes/workflow/attack-design.js        |   2 +-\n instruments/audit-changes/workflow/audit.js        |  19 +-\n instruments/bug-hunt/schema.json                   | 247 +-------------\n instruments/bug-hunt/workflow/dismissals.js        |   4 +-\n instruments/bug-hunt/workflow/hunt.js              |   2 +-\n .../bug-hunt/workflow/verify-architecture.js       |   2 +-\n instruments/check-consistency/PROTOCOL.md          |   4 +-\n instruments/check-consistency/workflow/panel.js    |   2 +-\n .../check-consistency/workflow/rubric-audit.js     |  13 +-\n instruments/check-docs/PROTOCOL.md                 |   6 +-\n policy/00-index.md                                 |   5 +-\n policy/RULES.toml                                  | 110 ++++++-\n policy/citations.md                                |   4 +-\n policy/docs-rubric.md                              |   9 +-\n policy/instruments.md                              |   4 +-\n policy/latex-idiom.md                              |   3 +-\n policy/testing-protocol.md                         |   9 +-\n schema/config.schema.json                          |   5 +-\n schema/exemptions.schema.json                      | 173 +++++-----\n schema/managed.schema.json                         | 120 +++----\n schema/pass.schema.json                            | 145 +++++----\n schema/tally.schema.json                           | 357 +++++++++++----------\n src/CLI/Audit.jl                                   |   7 +-\n src/CLI/Bump.jl                                    |  12 +-\n src/CLI/Config.jl                                  |  36 ++-\n src/CLI/Consolidate.jl                             |  13 +-\n src/CLI/Doctor.jl                                  |  22 +-\n src/CLI/Fleet.jl                                   |  19 +-\n src/CLI/Gate.jl                                    |   9 +-\n src/CLI/Git.jl                                     |  47 ++-\n src/CLI/Init.jl                                    |  26 +-\n src/CLI/Ledger.jl                                  |  11 +-\n src/CLI/Main.jl                                    |  11 +-\n src/CLI/Passes.jl                                  | 173 ++++++++--\n src/CLI/Preflight.jl                               |  87 +++--\n src/CLI/Recall.jl                                  |  31 +-\n src/CLI/Release.jl                                 |   9 +-\n src/CLI/RoundFiles.jl                              |   2 +-\n src/CLI/Rounds.jl                                  | 174 +++++++---\n src/CLI/Schema.jl                                  |  20 +-\n src/CLI/Seed.jl                                    |  28 +-\n src/CLI/Self.jl                                    |  13 +-\n src/CLI/Selftest.jl                                |   8 +-\n src/CLI/Sync.jl                                    |  83 +++--\n src/DocLints.jl                                    |   9 +-\n src/GBGCodingTools.jl                              |  11 +\n src/HtmlWalker.jl                                  |   9 +-\n src/Reflection.jl                                  |  33 +-\n src/Scan.jl                                        |  39 ++-\n src/Scans/args_form.jl                             |  52 ++-\n src/Scans/code_in_math.jl                          |   5 +-\n src/Scans/field_docs.jl                            |   2 +-\n src/Scans/mathbf.jl                                |   7 +-\n src/Scans/prose_shape.jl                           |   7 +-\n src/Scans/sibling_link.jl                          |  16 +-\n src/TestHarness.jl                                 | 133 +++++---\n src/TreeHash.jl                                    |  14 +-\n src/Witnesses.jl                                   |  20 +-\n templates/README.md                                |  10 +-\n templates/regressions-README.md                    |   2 +-\n templates/test-Project.toml.seed                   |   1 +\n test/Project.toml                                  |   6 +-\n test/config.jl                                     |   8 +\n test/coverage.jl                                   |  25 ++\n test/regressions/README.md                         |   2 +-\n test/rounds.jl                                     |  37 ++-\n test/scans.jl                                      |   9 +\n test/schemas.jl                                    |  46 ++-\n 85 files changed, 1802 insertions(+), 1140 deletions(-)",
    "executable_claims": [
        {
            "exit": 0,
            "log": "/home/grigory/Dropbox/Research and Teach/AI Helpers/GBGCodingTools/.gbg/scratch/2026-09-10-audit-changes-01/claim-gate.log",
            "command": "julia --project -e 'using Pkg; Pkg.test()'"
        },
        {
            "exit": 0,
            "log": "/home/grigory/Dropbox/Research and Teach/AI Helpers/GBGCodingTools/.gbg/scratch/2026-09-10-audit-changes-01/claim-the tree hash equals git's own.log",
            "command": "julia --project=test --startup-file=no \"/home/grigory/Dropbox/Research and Teach/AI Helpers/GBGCodingTools/test/treehash.jl\"",
            "file": "test/treehash.jl"
        },
        {
            "exit": 0,
            "log": "/home/grigory/Dropbox/Research and Teach/AI Helpers/GBGCodingTools/.gbg/scratch/2026-09-10-audit-changes-01/claim-the ledger disables and refines.log",
            "command": "julia --project=test --startup-file=no \"/home/grigory/Dropbox/Research and Teach/AI Helpers/GBGCodingTools/test/ledger.jl\"",
            "file": "test/ledger.jl"
        },
        {
            "exit": 0,
            "log": "/home/grigory/Dropbox/Research and Teach/AI Helpers/GBGCodingTools/.gbg/scratch/2026-09-10-audit-changes-01/claim-the scans hit their planted defects and spare the clean twins.log",
            "command": "julia --project=test --startup-file=no \"/home/grigory/Dropbox/Research and Teach/AI Helpers/GBGCodingTools/test/scans.jl\"",
            "file": "test/scans.jl"
        },
        {
            "exit": 0,
            "log": "/home/grigory/Dropbox/Research and Teach/AI Helpers/GBGCodingTools/.gbg/scratch/2026-09-10-audit-changes-01/claim-the witness runner classifies pass, fail, broken, blocked and refused.log",
            "command": "julia --project=test --startup-file=no \"/home/grigory/Dropbox/Research and Teach/AI Helpers/GBGCodingTools/test/witnesses.jl\"",
            "file": "test/witnesses.jl"
        },
        {
            "exit": 0,
            "log": "/home/grigory/Dropbox/Research and Teach/AI Helpers/GBGCodingTools/.gbg/scratch/2026-09-10-audit-changes-01/claim-a round closes only through its channels.log",
            "command": "julia --project=test --startup-file=no \"/home/grigory/Dropbox/Research and Teach/AI Helpers/GBGCodingTools/test/rounds.jl\"",
            "file": "test/rounds.jl"
        },
        {
            "exit": 0,
            "log": "/home/grigory/Dropbox/Research and Teach/AI Helpers/GBGCodingTools/.gbg/scratch/2026-09-10-audit-changes-01/claim-the managed files are exactly what sync renders.log",
            "command": "julia --project=test --startup-file=no \"/home/grigory/Dropbox/Research and Teach/AI Helpers/GBGCodingTools/test/sync_doctor.jl\"",
            "file": "test/sync_doctor.jl"
        },
        {
            "exit": 0,
            "log": "/home/grigory/Dropbox/Research and Teach/AI Helpers/GBGCodingTools/.gbg/scratch/2026-09-10-audit-changes-01/claim-every artefact matches its schema.log",
            "command": "julia --project=test --startup-file=no \"/home/grigory/Dropbox/Research and Teach/AI Helpers/GBGCodingTools/test/schemas.jl\"",
            "file": "test/schemas.jl"
        },
        {
            "exit": 0,
            "log": "/home/grigory/Dropbox/Research and Teach/AI Helpers/GBGCodingTools/.gbg/scratch/2026-09-10-audit-changes-01/claim-the gate refuses a build around an open round.log",
            "command": "julia --project=test --startup-file=no \"/home/grigory/Dropbox/Research and Teach/AI Helpers/GBGCodingTools/test/gate.jl\"",
            "file": "test/gate.jl"
        }
    ],
    "schema_version": 1,
    "round": "2026-09-10-audit-changes-01",
    "covered": [
        "src",
        "test",
        "ext",
        "docs",
        "Project.toml",
        "fixture",
        "policy",
        "instruments",
        "templates",
        "catalog",
        "schema"
    ]
}
